ID,MWS,Group,Database,Layer,Name,Provider,Level,Geocode,Type,Discription,geojson,Year
1,MWS-019,Proposal,Soil and Water Conservation,Key activities proposed for soil and water conservation in MWS-019,,,,,,,https://raw.githubusercontent.com/MWS003-GIS/MWS003-GIS.github.io/main/IWWRMP/Data/Proposal/MWS_019/Table_6_1.geojson,
2,MWS-019,Proposal,Soil and Water Conservation,Details of Reported landslides in MWS-019,,,,,,,https://raw.githubusercontent.com/MWS003-GIS/MWS003-GIS.github.io/main/IWWRMP/Data/Proposal/MWS_019/Table_6_2.geojson,
3,MWS-019,Proposal,Minor tanks restoration,Details of minor tanks available in MWS-019,,,,,,,https://raw.githubusercontent.com/MWS003-GIS/MWS003-GIS.github.io/main/IWWRMP/Data/Proposal/MWS_019/Table_6_3.geojson,
19,MWS-019,Proposal,Minor tanks restoration,Summary of costs for Rehabilitation and improvements to minor tanks,,,,,,,https://raw.githubusercontent.com/MWS003-GIS/MWS003-GIS.github.io/main/IWWRMP/Data/Proposal/MWS_019/Table_6_19.geojson,
26,MWS-019,Proposal,Water resource management,Estimate of domestic water supply and water source related activities,,,,,,,https://raw.githubusercontent.com/MWS003-GIS/MWS003-GIS.github.io/main/IWWRMP/Data/Proposal/MWS_019/Table_6_26.geojson,
27,MWS-019,Proposal,Water resource management,Cost estimate of minor irrigation-related proposals with locations,,,,,,,https://raw.githubusercontent.com/MWS003-GIS/MWS003-GIS.github.io/main/IWWRMP/Data/Proposal/MWS_019/Table_6_27.geojson,
30,MWS-019,Proposal,Water quality improvement,Details related to water pollution in MWS-019 belongs to Mathurata DS Division,,,,,,,https://raw.githubusercontent.com/MWS003-GIS/MWS003-GIS.github.io/main/IWWRMP/Data/Proposal/MWS_019/Table_6_30.geojson,
32,MWS-019,Proposal,Stream reservation,Total Cost Estimate for streambank reservation conservation proposals,,,,,,,https://raw.githubusercontent.com/MWS003-GIS/MWS003-GIS.github.io/main/IWWRMP/Data/Proposal/MWS_019/Table_6_32.geojson,
