"Table 6.2: Details of Reported landslides in MWS-027","","","","","","",""
"No","GN Division No","GN Division","Land Slides","Coordinates","NBRO Recommendation","Proposed Measures","NA"
,,,,"N or X","E or Y",,
"1","515E","Maha Uva","Land sinking - Field No. 2 Division","7.069336","80.87431","Needs NBRO concern","Sinking happened in 2013 and it is settled at the moment. Land use planning and removal of risky houses should be done following the advices of NBRO. Further, providing suitable lands is needed."
"2","516","Ketakandura","Landslide - Ketakandura Madawala Watta (The embankment, about 12 m high, was cut vertically during the construction of the road, Therefore, banks collapse during rainy season)","7.102161","80.873781","NBRO has been informed","Actions should be taken following the advice of NBRO"
"3","516A","Kendagolla","No special issues reported",,,,
"4","516B","Egodakanda","No special issues reported",,,,
"5","516C","Werellapathana","No special issues reported",,,,
"6","516D","Mahapathana","Landslide - Ma Ussakelle","7.05791","80.872832","NBRO is aware","Removal of risky houses and providing suitable lands"
