"Table 6.18: Time frame for implementation of minor irrigation proposals","","","","","",""
"GND No","Name of Irrigation System","N","E","Observation","Description","Amount  Rs"
"504 A","Binganthalawa Ihala Ela","7.049681","80.860814","Existing earthen canal has been damaged. Due to 35.0m long section of the canal has been breached, water is being obtained using pvc pipes. Command area 50.0 acres","Canals reservation protection by concrete lining  For  100mm thick , 0.3m  wide  and 0.3m high canal -double bankingStream / canal  reservation protection by earth filling of  strip   of 1.5m to 2m wide  and average Depth of 0.5m, Turfing to new sloping  soil surface (DAD  D 01) or planting  single row of vetiver grass with ecofriendly edible plants like Gotukola, Mukunuwenna, Thampala etc. including application of compost manure and 02 months maintenance
Vegetative cover improving (1.5m-2.0m wide) with Areca nut seedlings @ 1.5m spacing in two rows, Beetle creeper VP @ 3m spacing in a single row, Green gram as a cover crop including applying of compost manure, NPK fertilizer and maintenanceMiscellaneous","1,900,000.00"
"504 A","Binganthalawa Pahala Ela","7.052414","80.862667","Existing earthen canal has been damaged. Command area 100.0 acres","Stream / canal  reservation protection by earth filling of  strip   of 1.5m to 2m wide  and average Depth of 0.5m, Turfing to new sloping  soil surface (DAD  D 01) or planting  single row of vetiver grass with ecofriendly edible plants like Gotukola, Mukunuwenna, Thampala etc including application of compost manure and 02 months maintenanceVegetative cover improving (1.5m-2.0m wide) with Areca nut seedlings @ 1.5m spacing in two rows, Beetle creeper VP @ 3m spacing in a single row, Green gram as a cover crop including applying of compost manure, NPK fertilizer and maintenanceMiscellaneous","368,000.00"
"504 A","Sagalapura Pahala Ela","7.055777","80.855612","Existing canal has been concreted Command area 20.0 acres","Canals reservation protection by concrete lining  For  125mm thick , 0.5m  wide  and 0.4m high canal -double bankingMiscellaneous","325,000.00"
"504 B","Anicut and Canal in No. 11 Block","7.064564","80.839673","Existing Earthen canal,  Command area of 4.0 acres, about 400 families taken drinking water.","Canals reservation protection by concrete lining  For  125mm thick, 0.5m  wide  and 0.4m high canal -double bankingStream/canal reservation protection by earth filling of  strip   of 1.5m to 2m wide  and average Depth of 0.5m, Turfing to new sloping  soil surface (DAD  D 01) or planting  single row of vetiver grass with ecofriendly edible plants like Gotukola, Mukunuwenna, Thampala etc including application of compost manure and 02 months maintenanceVegetative cover improving (1.5 m-2.0 m wide) with Areca nut seedlings @ 1.5m spacing in two rows, Beetle creeper VP @ 3m spacing in a single row, Green gram as a cover crop including applying of compost manure, NPK fertilizer and maintenanceMiscellaneous","1,441,000.00"
"504 D","High foresat No. 1 Spring (Canal from Mahakudugala Bridge)","7.05441","80.82719","Part of the existing canal has been concreted and balanced part earthen canal, 20.m long section of existing earthen canal has been damaged. Command area: 100.0 acres","Canals reservation protection by concrete lining  For  125mm thick, 0.5m  wide  and 0.4m high canal -double bankingStream/canal reservation protection by earth filling of  strip   of 1.5m to 2m wide  and average Depth of 0.5m, Turfing to new sloping  soil surface (DAD  D 01) or planting  single row of vetiver grass with ecofriendly edible plants like Gotukola, Mukunuwenna, Thampala etc. including application of compost manure and 02 months maintenanceVegetative cover improving (1.5 m-2.0 m wide) with Areca nut seedlings @ 1.5m spacing in two rows, Beetle creeper VP @ 3m spacing in a single row, Green gram as a cover crop including applying of compost manure, NPK fertilizer and maintenanceMiscellaneous","1,259,000.00"
"533 I","Canal Near the Temple","7.039929","80.833099","It starts with the wildlife reserve. Existing Earthen canal,  Water is used for vegetable cultivation on 40 acres.","Construction of 1:3:6 (1 1/2\") concrete retaining wall (height 1.5m, top width 0.15m, 0.50m high steps x 03, each of 0.15m step width & bottom width 0.60m)Vegetative cover improving (1.5m-2.0m wide) with Areca nut seedlings @ 1.5m spacing in two rows, Beetle creeper VP @ 3m spacing in a single row, Green gram as a cover crop including applying of compost manure, NPK fertilizer and maintenanceMiscellaneous","1,075,000.00"
,,,,"Total",,"6,368,000.00"
